{
  "ok": true,
  "output": {
    "modality": "text",
    "text": "{\"headline\":\"sintético\"}"
  },
  "usage": {
    "inputTokens": 120,
    "outputTokens": 40,
    "images": 0
  },
  "resolvedProvider": "oplyra-test",
  "resolvedProviderModelId": "oplyra-test/text-economy",
  "ignoredParameters": [],
  "externalRequestId": "test-00000001",
  "billing": {
    "kind": "charged",
    "reportedCostMicroUsd": null
  }
}
